{
  "skill": "relationship-briefing",
  "version": "0.2.0",
  "status": "needs_review",
  "model": {
    "provider": "openai-compatible",
    "base_url": "https://api.z.ai/api/coding/paas/v4",
    "model": "glm-5.1",
    "temperature": 0.1,
    "source": "shared_local_file"
  },
  "target_person": {
    "person_name": "Jordan Li",
    "person_ref": "person_jordan_li",
    "relationship_stage": "稳定联系",
    "summary": "算法技术负责人，偏理性调停与现实判断，能提供真实优先级和资源约束信息。"
  },
  "context_receipt": {
    "auto_context_applied": true,
    "auto_context_interaction_count": 3,
    "auto_context_used_views": 1,
    "auto_context_view_path": "relationship-view/views/person_jordan_li.md",
    "auto_context_source": "profile_store_and_view"
  },
  "briefing": {
    "quick_brief": "这次沟通的关键不是争取承诺，而是借Jordan Li拿到真实优先级、资源约束和继续推进的窗口判断。",
    "relationship_read": {
      "current_state": "稳定联系",
      "likely_intent": "希望分工更清晰、团队不被反复拉扯，同时避免在未定调前被动背责任。",
      "attitude": "谨慎但坦诚，愿意给事实判断，不会轻易表态承诺。",
      "trust_level": "medium"
    },
    "approach_strategy": {
      "goal_translation": "先拿真实判断，再决定后续是否继续投入推进天气 Agent。",
      "recommended_opening": "先追问上次待办的真实结果，再问他当前对优先级和资源窗口的判断。",
      "recommended_style": "务实、直接、留出空间，让对方说事实而不是被迫表态。",
      "why_now": "上次同步后已有新信息沉淀，现在最适合核对判断并刷新策略。"
    },
    "talking_points": [
      "上次和浩总、陈卓同步后拿到了什么具体反馈？",
      "当前天气 Agent 的技术投入优先级在团队里排第几？",
      "如果继续推进，最小可行的承接方式是什么？",
      "曾科团队和当前路线的重叠度是否发生变化？"
    ],
    "watchouts": [
      "不要直接让Jordan Li给承诺",
      "不要用愿景和激情话术施压",
      "如果出现模糊表述，要追问事实和原话"
    ],
    "questions_to_ask": [
      "浩总最近给过什么明确信号？",
      "如果下周被要求降级推进，你们会怎么承接？",
      "你现在判断天气 Agent 还有没有 P0 级窗口？"
    ],
    "next_actions": [
      "根据他的反馈决定是否直接找更上层要定调",
      "如果判断偏保守，准备一版最小可行承接方案",
      "把他给出的真实信号同步给相关方"
    ]
  },
  "briefing_file": {
    "written": true,
    "path": "relationship-briefing/briefings/2026-04-18-jianfeng-weather-agent.md",
    "title": "2026-04-18 Jordan Li会前简报",
    "slug": "2026-04-18-jianfeng-weather-agent"
  },
  "user_feedback": {
    "headline": "已为Jordan Li生成会前简报",
    "summary_lines": [
      "目标人物：Jordan Li",
      "关系阶段：稳定联系",
      "自动召回互动数：3",
      "已补充持续视图上下文"
    ],
    "next_action": {
      "type": "open_briefing_markdown",
      "message": "优先打开生成的 markdown 简报，按 1-3 分钟会前速读使用。"
    }
  },
  "open_questions": [
    "Jordan Li最新的上级信号是否已经足够明确？",
    "当前最小可行承接方案是否需要再补充资源评估？"
  ],
  "notes": "如果对方继续给模糊反馈，优先追问事实、原话和具体时间点。",
  "run_directory": "relationship-briefing/runtime/runs/2026-04-18T02-45-55-042Z-person_jordan_li"
}
